reviewText,overall
bought car new motor trend car year first time buy new car list understand way back year later lemon car every problem google car happen catalytic converter go crankcase sensor fail valve cover leak oil cylinder causing misfire code ac problem loss heat problem last year winter nice hard start cold blow smoke sporadic problem though love idea plastic door handle cheaply made break ease wait till change see feel car repair way make drive crazy oh headlight bulb replacement joy replace pair stop let google rest run car cant wait trade,0
obviously nice car new old rotten,0
something brake design foul replace often car cheap buy originally noticed kia became expensive market place nissan versa becoming front runner least expensive car biggest problem dealer carry engine metal shaving dealer said engine replaced mile cleaned oil pan guess bad,0
horribly designed engine l make sure get one youll regret,0
great car nothing meant use leather seat stitching unwound motor mount failed le mile window regulator replaced plastic crumbling touch generally poor product replace engine monitorsensors mechanic would loved car need work time nothing easy get compare year ford escort none issue mile,0
hole bulb loose connector would hold buy additional ring make stay plastic thinner show,0
never euro trash,0
electrical vacuum system problem k,0
star truck minus dodge dealer loved truck drove year problem transmission needed work year extended warranty bought didnt cover anything dodge dealer service department untrustworthy stopped using dodge service department getting second opinion learning lied repair needed tune one good thing didnt want deal dodge learned lot working vehicle changed alternater serpentine belt master brake cylinder oil change etc also found wonderful local mechanic able recommend people car truck beast called mine big red traded new car last summer still miss new car point point b type vehicle big red ride drove well pickup got flood saw lower profile vehicle stranded got heavy snow ice always loved getting side eye old dude little self jumped cab one mechanical breakdown entire year gas tank fell thats traded becoming rust metal want purchase used one dont spend much mechanic look first check rust get dodge dakota maintenance book ive driven nissan pu dodge ram ram enormous comparable nissan stiff little piece junk sadly experience dodge dealer ill never another vehicle company ill always miss big red,0
still running requires constant maintenance door lock handle broken factory paint car almost appears worn basically po kid drive,0
since new mile lot problem year repair could afford drive great ride good currently service ab traction control problem fix one putting sale,0
car dy warning one ever figure,0
l power,0
costly suv ive heard good bad story model second blazer proved lemon given really like look feel ride,0
never chevy fan ended blazer bc couldnt afford toyota wd stupid mistake never,0
bought used bought another person headache,0
cheaply made,0
im big fan single cab truck prefer crew cab absolutely nothing le king cab hope helpful,0
break lot,0
disclaimer product obtained cost thoughtful generous well meaning gift dear relative sarcasm look sumbitch horse square mouth thing broken despite monastic adherence maintenance schedule fuel pump fuel level sensor driver side power door lock actuator fell rivetedin course good luck fixing exact plastic intake manifold ford recalled oh sitting warehouse extra year sure trick horn cruise control ac lcm replaced recall still suck turn whenever plea turn signal stalk longer cancel automatically cabin electrical system shorting god know vehicle currently running misfire per minute idle thanks coolant flowing costsaving plastic intake manifold pooling poorlydesigned drainholes plug access hole let tell jerking stumbling sensation wonderful paired blinking check engine light one simply must experience understand simple lip around plug hole coil boot fit something literally every manufacturer thought would adequate protection seems forwardthinking design frowned upon within ford modular v design team leak also spill coolant onto hot engine part vent cool james bond smokescreen side hood good look stoplight parking lot work ford want fix straight known acknowledged manufacturing defect want thing add short possibly another costconsciously engineered electrical module randomly sometimes rapidly turn interior lighting headlight theyre auto mode quite formidable ride hand whenever blinking happens hear relay somewhere god know clicking sometimes rapidly point buzz click sometimes drain entire battery overnight discernible reason really defect like side effect kid trying buy beer might take note driving vehicle make appear least year one narrowly escaped felony older actually,0
great car expensive maintain install spark plug entire top engine need removed rear main seal leak around k mile take hour fix oil cooler filter attache leak time driver seat broke common problem go dealer repair cost took u hour make repair part available online amazon rear visibility poor smashed tailgate didnt see mailbox changing fog light requires removing wheel removing fastener squeezing hand tight spot get bulb passenger side also loosen bumper get bulb behind washer bottle doityourselfer dont waste money get something serviceable cant imagine thought behind engineer designed car think applies muranos,0
need much work replacement part ford focus sale new york pas inspection person sold inspection sticker good till march march right around corner im trouble amazon telling cant ship catalytic converter need desperately pas inspection thank,0
bought car mile biggest piece c ever owned car problem small big never one seat electronics window button radio wont pick station dont know seat move name rotted sunroof,0
wish knew know car rear end issue irs tranny issue solenoid pack develope often around k mile expensive fix rear end replacement around k transmission repair hard spend k k car typical ford heatac blend door issue,0
great car subaru stand behind warranty engine blew rod mile still bumper bumper warranty sue fix engine,0
many problem,0
car still running good kind electronic issue current mileage k mile failed item far driver side air bag sensor failed replaced dealership cost seat belt sensor failed replaced dealership cost even replacement indication seat belt window lock sensor sticking since alert every time hit bump door need opened closed fuel tank sensor failed never closed outer cover sine passenger side motor failed week found motor still ended paying passenger side airbag sensor failed quoted engine light charging volkswagen dealership couldnt find problem worst car ever bought vw brand product ever life,0
want comfortable solid german suv fraction original pricenew want reliable suv empty saving within month purchasing go toyotalexus,0
e loved brand new developed every single issue plague truck first truck couple eletrical gremlin would come go rolling rear right window able roll back sunroof started leaking track plastic crack year weather sun coupled drain driverside apillar come apart model caused water leak top driver foot well fatal developed intermediate lever eccentric shaft issue develops due cold weather known issue bmw year service bulletin recall issue start showing symptom pretty much late slowly oil track engine gum blow blue smoke random misfire start guzzling coolant heating end truck literally undriveable engine receives oil spark thus power limped steaming smoking dealer trade reliable suv advice youre looking keep looking one run trade dy,0
bmws great run warranty check common bmw car forum maintenance going cost arm leg,0
would perfect actually fit,0
looking fixer upper something get mountain back working would avoid vehicle interior spaciousness nice roof rack carrying kayak around trailer hitch option plus pain work alternator went mine instead able simply swap new one take shop reason volvo decided bury alternator underneath tube wire metal bar meant wanted replace would take passenger headlight side panel reach guess sweden alternator never go stupid many item design vehicle annoy especially since im diyer price tag serpentine belt longer biggerwhatever oil filter cant accessed simple oil filter removal tool since buried deep engine body special type rear differential take special kind differential fluid cheap many many annoyance vehicle worth time effort want project vehicle,0
car reliable mechanically sound falling apart inside pretty much since got used cheap material item like dash resulting plastic bubbling warping heat sunlight item relating interior body failing one one engine still start run reliably get money worth car opening satisfying experience,0
kia spectrum poorly manufactured car cheap material mile seat ripped seam around mile car several brake system leak sun visor failed stay time third tail light plastic deteriorated normal condition started crumble dropping rear seat huge challenge clearly latch poor fit gas pedal obstruction block foot moving brake pedal large human sized foot shoe likely snag switching gas brake seems like fundamental design flaw least car still drive mile,0
engine sits low pull curb ac pulley hit end braking timing belt buy junkyard head rebuild dont like engine sound year ago good car,0
one problem another,0
thought would made better hard jam stock mirror get plastic skrew doesnt thread mirror took pocket knife got work barely going return need trip glad bought used one le,0
pick good little window problem,0
buy,0
auto tech year enjoyed taking task like oiltransaxleradiator fluid change brake pad sensor etc simple oil change took twice long complete stuck thermostat took mechanic hour complete get thermostat engine need come apart upperlower intake manifold air filter radiator seems location instrument intentional positioned make car serviceable bumper pulled due cement tire stop parking lot bumper lip bottom low caught top tire stop driver seat sunk cloth tore underneath cushioning alarm trip intermittently probably door close completely trunk tends open strereo make clicking sound played quietly,0
overall car great good gas mileage handle well low rating actually onstar known problem would onstar would never gotten,0
bought car based good experience previous lesabres older car went well mile little repair needed lesabre multiple expensive repair reaching mile third plastic intake manifold crack leak coolant fix time speedometer failed fix turn recall one benefit car couple year old clockspring device inside steering column failed airbag inoperative fix rear wheel bearing gone wheel almost fell car fix ive lesabres,0
mile run fine occasional burp transmission turn engine reset,0
buy new lot trouble could great buy wes new,0
nissan america suck customer service worst recall matched issue year vin guess luck truck went wheel bearing k mile warranty exhaust sytem fell bottom truck front end issue really could good truck,0
driver side sun shade keep flopping seems common problem model expensive replace happy driving car like driving truck feel bump pot hole road air conditioning take longer cool car summer toyota van vent point ceiling directly driver passenger last car nissan,0
nice car pricey upkeep tuneups oil change,0
plagued issue pneumatic suspension system issue gas tank leak location leak back seat numerous issue tire inflation due wheel issue fun comfortable ridebut worth headache find time take shop extraordinarily expensive repair mention expensive routine maintenance,0
great looking ford stealership mile tranny problem cop replacement entire cooling system failure radiator hose gasket blew gasket cd player broke rear window break away convertible top parking brake boot cheap piece plastic always break two main gasket replacement evap leak cant even count brake job ive five new tire buy map light didnt work leather seat constantly tear update broke side highway degas coolant bottle cracked towed stealership another,0
aftern mile mdx keep breaking spend much money fix,0
feel like driving gocart,0
poor gas mileage rust easy,0
unfortunately purchased used vehicle form supposedreliable salesman recommendation doctor wife used work prior owner supposed friend single owner able hide major issue car make salable driver door leak top heavy rain car wash vehicle major electrical issue electrical system serviced twice tune time stand autolock door feature called lock second regardless whether key ignition ie lock recently car shipped wa state va told driver leave key carignition due lockout possibility forgot got locked call locksmith sunroof get stuck open position making fearful using possibility staying way terrible another bug constant cel coming advanced auto twice past investigate code could say generic code cooling system specify something specific ive entire coolant system flushed thermostat replaced keep getting error every two week due bought code readercode clearer amazon light come use clear code inevitably however come gas cap release mechanism recently quit working cover would open pry open screw driver breaking small plastic tab process secured velcro thing like sound system monsoon actually best stereo system ever car reason second star rating never buy another vw vehicle,0
car suck southern usa plastic crack paint fade etc engine bullet proof underpowered,0
expensive spare part constant failure costing lot money regret,0
many thing went wrong car every time easy fix would cost matter simple problem many feature kept breaking warning light always came broken sensor v power great nice roomy gas mileage horrible got mile per gallon sold within first year,0
nice car drive lot nice feature turned maintenance nightmare shop every month something major expensive,0
great fuel economy part plentiful inexpensive look stylish sporty dont fooled practical econobox didnt like speed manual weak transmission left stranded mile spite oil change zz engine piston ring get stuck engine start burning oil spite fixed problem swapping c transmission xrs durable regular c rebuilt engine new piston ring also put trd spring tokico blue firmed ride bit mile money pit im enjoying matrix overall,0
knob fit remove metal sleeve pain get fit knob glued pay extra mazda dealer next time,0
first year good car buy ever since one probably another see went business,0
weak car many problem,0
head gasket replaced mile strut replaced mile motor replaced mile electrical problem,0
bought gls tdi new engine trans vws tend bulletproof abused get mpg hwy however rest car one nitpicking repair another mile mine ive owned golf various vintage k always seems here list sunroof leak connection one drain came apart past warranty water stained roof side panel filled various cavity full water car smell like gym locker room drain connection poorly made imo problematic design since fairly common problem youtube vid fix luckily rear drain one front drain access front much involved remove plastic panel see plastic seat warmer quit working im lucky since mine quit working didnt catch fire reportedly plastic used vehicle get brittle cold temp deg forget popping plastic panel kind like cold chocolate plastic expensive replace dont heated garage fuggetaboutit alternator clutch pulley diy fixinc purchase necessary special tool often misdiagnosed variously expensively bad alternator psteering pump etc rear brake caliper adjuster quit working corrosion build parking brake wont completely release dragging rear brake rr rear caliper alarm going apparently hatch door get corrosion keyhole eventually causing door ajar light time alarm go occasionally usually late night annoying neighbor took rear panel offplastic see cold fixed blasting wd inside lock mechanism door working key back forth keep gremlin away best use key open rear hatch instead fob remote release button driver side door appears work mechanism enough keep issue bay hardware cheap plastic screw bolt nut corrode readily adding repair woe center arm rest latch flimsy expensive replace door lock lock door second later open lock open lock open course im mall parking lot stuff car google searched turn cause usually fuse burn replaced fuse good go phew alloy rim peeled bubbled paint corroded eye sore constant source air leak bead headache coolant sensor needed replaced new improved type bew eng two type diesel year bew ach bew engine issue camshaft scoring bew ive symptom show yet fortunately mine one fraudulent emission control diesel soft suspension vw order boost mpg diesel cranked tire pressurespsi rear instance necessitating soft suspension spring keep loosing tooth filling make squirrely handling back country road front suspension readily bottom undulating roadway especially heavy diesel front fahrvergnugen make car volkswagen money wife bought camry cyl needed replace coolant pump k mi known issue lucky cyl camry owner routine maintenance oil filter battery serp belt brake tire rr fluid thats done volkswagen,0
thought would higher quality price,0
liked refunded really fast didnt like stitch coming material,0
people need know car shape suv isnt offroading vehicle good see people really happy tucson ive replaced everything year weve maybe say previous owner zero maintenance ive done common thing like new wiper new battery couple new tire headlight tail light extensive thing like replaced fuel pumpfilter lifter water pump timing belt spark plug recently alternator part exhaust broke apart making thing noisy still need fix transmission slipping also think brake job near future,0
warranty expired paint start flake part start need replaced,0
best car owned purchased new car mile done scheduled maintenance time use synthetic oil car look run great electronics worked fine interior leather except left hip bolster show wear driver seat interior perfect car get mpg mph,0
poor electrical system leather seat worn diy repair fuel system poorly designed,0
motor great frame rusted ity isnt even safe nasty frame great car,0
ok van van long feature started fall apart example cd player dvd player press button open window door broke one string sucked one side could get car thru driver side,0
wrong part malibu classic,0
wrong color may even fault ordering thought white led light amber turn signal red,0
started fall part mile would expect mile,0
nothing ab brake issue everything replaced brake ab light still wont turn looked issue learned ongoing problem rendezvous also k mile head blew learned issue well car never driven hard either towed anything,0
overall truck handle well ride well quite capable snow light roading ruined otherwise good vehicle absolutely horrible engine apart three time time bad head gasket timing chain wanted swap weak oil pump remove front axle drop oil pan engine prone oil foam sludge build electric overdrive transmission buck hard going od could fantastic truck stuck tried true engine torqueflite true gear driven transfer case real low range would also go back inch wheel tire wouldnt buck apiece truck unnecesarily expensive overly complex therefore unreliable considered anything light use,0
many brake problem suv,0
perhaps one worst vehicle ever built truck diesel like many owner diesel model bad history head gasket problem,0
product new expected however come instruction look instruction youtube install,0
way many electrical problem complete dash light speedo tach gauge failed one time brake line completely rust almost bad accident front wheel hub side replaced twice overall would probably never purchase another gm product ive always owned gm yr let loyal customer,0
small inside small improvement gas mileage full size truck done maintenance truck timing chain needed changed mile pull engine simple job waste,0
never buy one poorly engineered vehicle disassemble front end car base window tune service bulletin warns install mastic tape reassembling vehicle prevent water ruining onboard computer transmission notorious failure without warning vehicle k secondary air system designed allegedly prevent exhaust toxic joke part canister pump sensor etc expensive epipens rip pricing general statement driver million mile driven minivan designed expensive maintain pas k,0
engine requires lot attention,0
comfortable ride underpowered terrible terrible cornering,0
thread pitch length correct however crush washer could crushed leaked enormously get one dealer whole work perfect leak,0
issue timing chain rattle oil consumption plugged catalytic converter plastic valve cover require replace entire valve cover order repair tube seal leak manual transmission failure car well received initially common problem expensive repair,0
want car hold road long trip car get good gas mileage comfortable ride,0
much trouble specially electrical electronics conponent engine say good wear tear part need replace place prematurely paint dash bubling cracking,0
unreliable expensive maintain horrible air suspension way heavy poor gas mileage quiet inside thats positive thing say real turd vw,0
car atleast model year nice car reliability issue fit finish initially great leather seat hold great paint coding touch surface peel scratch easily look bad year computer replaced drive shaft wiring head light start decay headlight needed replaced headliner needed replacedetc hopefully improved issue newer model,0
okay suv bit hard work sold mine started leaking oil transition motor somthing willing take expensive macanic good suv,0
purchased new k mile post warranty confirmed head gasket leak taken care vehicle parent vehicle since late never ever head gasket failure mfg ford honda toyota volvo chevrolet buick pontiac weve owned oem gasket used nonturbo ej engine model poor quality well documented plagued subaru decade inexpensive repair either k im holding repairing timing belt left right inner cv boot torn common amongst subaru repaired hood latch lock failed replaced besides maintenance need performed vehicle issue car unprecedented consider unacceptable ok car,0
part expensive easy car work,0
nothing else really matter start leaf stranded mile home shop northern michigan could fix due volvos proprietary software couldnt even find put trailer towed home pull dash put new ignition switch year multiple big bill battery died happen expensive died week car started smell burning plastic made dealership new alternator battery warranty would cover battery fried alternator many thing happening mile needed fix traded,0
smooth ride youre millionaire lease one thesebrand newfor three year give back love car dont throw money away buying one trade end value extremely low car lot afraid good reason cost fortune make simple repair quite simply car engineered stand test time unless youre top notch mechanic ability reengineer bmw system way make repair inexpensive used bmw definitely car said ive enjoyed mine engineer see lot genius work end day genius result barrage problem list common adaptive headlight fail k replaced cost car upgraded aftermarket led light save three grand resistance change circuit resulting barrage fault notification startup fix pirate copy bmws nc expert coding software spend day translating german per bmw car start weight oil improves performance part wear result inadequate lubrication oil leak consequently higher milage bmws leak oil run hot due overcomplicated cooling system isnt programmed contend added heat poorly lubricated worn part prove point dare google bmw fire shocked appalled many house burned car one contributing factor plastic skid plate cover entire bottom car allowing oil build around exhaust pipe another consequence bmws low weight oil recommendation camshaft bearing wear ledge allow oil slip past higher milage engine since vanos valve control valve timing depend upon upper engine oil pressure idle speed extreme difficulty maintaining valve timing engine sputter check engine light come fix right bearing ledge replaced cost aftermarket part intake side cost head exhaust side simpler far le expensive fix simply use heavier weight viscus oil far keeping cooling system check auxiliary fan commonly fails commonly misdiagnosed many forum start talking replacing electric cooling pump thermostat end replacement aux fan bmw put temperature gauge car temp fluctuates disturbing way contributing factor common oil leak fire late model bmws known new fan bmw cost aftermarket fan cost rely temperature switch close degree celsius oscillating signal ecu control fan speed bmw recognizes higher milage engine typically run hot recommend replacing oem switch aftermarket version tun fan degree celsius however forum recommend replacing oem aux fan dual fan stay time regardless switch many interior part refinished car year chrome plating peel becomes sharp fabric headliner glued back couple personal annoyance passenger side mirror tilt ground put car reverse unless keep mirror adjustment switch set passenger side take two pull handle open door,0
worst engine ive ever seen two large repair piston ring part km never buy another,0
break break hard diagnose problem,0
part didnt fit say fit car part wasnt described photo,0
didnt like fit get pay,0
bought car new water pump go k mile last year cost nearly replace k front strut need done year cant wait unload car,0
combined sprinterwinnebago produced designed vehicle weight everything average person carry think improved problem later model spent thousand rv spend milage buy small trailer next time,0
good gas fast run smooth many eletrical problem,0
detail screw missing come bulb also turn signal work,0
nice car run like champ live mechanic shop soon hit k mile car close k worth maintenence done still done time totaled hit run like think fool gold,0
