reviewText,overall
reliable little car whose biggest asset every morning turned stylish comfortable nope something make lady swoon men salivate go minute really climb mountain sure give enough time turn well owned gxe manual version car bought k mile reason got rid k mile idiot teenager plowed parked street car still functional drove great sold guy drove chihuahua mexico missing back wheel besides still solid ride power lock power window still went fancy little dongle thingy unlock car afar really sexy cd player practical number cup holder front back lumbar support driver seat much desired dont think rd team spent lot time comfort aspect car got car instantly reminded car wasnt meant comfortable instead build character give constant worry far behind retirement fund k mile year owned car thing died car ac pump thats fault knew leaky allowed pump run dry bolt somehow got stuck onto gas pan thingy sawed windshield wiper fluid reservoir fell engine compartment oil dipstick broke fished car horn stopped working front cigarette lighter stopped working heater dying feel like thats pretty good considering responsible car owner regular oil change quality oil made sure fluid always topped brake rotor spark plug battery tire etc also replaced fall basic maintenance suspension also shot ball joint control arm definitely rusty replaced honestly whole underside car needed serious help never maintenance changed part expected car chain timing belt never got timing belt done car manual didnt worry automatic transmission original clutch held strong entire time however car simple maintain perform basic maintenance also easy repair straightforward simple car piece practical place really didnt need fancy tool bendable arm also dont need lot money maintain repair car diyer part car actually affordable like car really cheap begin poor people catalytic converter throw error easily bit annoying basically look like throw error anything efficiency always passed emission used auto mechanic bullshit meter useful car clueless girl mechanic trying convince error mean car going explode cant comment safety car never accident died due safety feature compared newer car however also mean le sensor deal car dont care dont brake light airbags dont work fire let drive whatever condition happens even mean die front wheel drive car lousy snowrainmildly moist condition however driven rocky mountain blizzard car surprisingly made multiple time go slow use right gear car get place eventually car driven california nebraska colorado georgia illinois british columbia driven mountain pass basked beach scuttled along rugged dirt road however decent road tripping car due great gas mileage got mpg car easily though highway got mpg also handy back seat fold get slightly longer item loaded trunk like hat stand trunk like mary poppins bag though amazed much junk able shove want mediocre cheap simple maintain car miraculously keep turning car want style safety feature engine power back pain relief probably look car,1
bought jeep new retired minor issue overall pleased thinking getting another jeep product granddaughter eye one turning year would good car,1
purchased avalon new recall taken care tsb steering column made clicking noise repaired car around mile around mile later started making noise dealer want fix wrote toyota letter ended paying car mile problem free,1
doesnt car play expensive tech package bought get auto brake mostly worthless spouse like car okay car base crossover,1
comfortable ride bell whistle standard complaint would gas mileage,1
kept car mile mile totalled accident complaint id automatic transmission v replace mile expected replace one time keep car past mile car comfortable smooth rattlefree nearly everything worked perfectly end engine strong never leaked burned oil,1
great car engine sound change oil every mi sun havoc interior paint hood literally baked moving ny soon possible,1
became owner truck k mile typical high mileage problem replace inner outer tie rod side well wheel hub assembly side pitman arm idler arm replaced ive two sensor go front driver side axe seal began leaking replace rubber boot cracked axel caused axel wear replaced whole front driver side axle im waiting side go poor design problem knock sensor bad put replacing big job due water able get sensor cause corrosion thus poor ground issue sensitive issue requires research tackling issue correcting also mean taking action fix original design wont happen im k issue really big deal expected go k would fall routine maintenance category minus knock sensor result poor design pay shop work would cost lot money able much cheaper got keep tool ive trouble engine transmission thing would able fix thus conclude fairly decent truck judging review better get k major problem,1
overall solid truckgas milage could bettertune costed grand poorly designed plug placement,1
purchased g back still car mile engine transmission maintained car car daughter learned drive,1
ribald standard,1
typical jeep buy one road ability creature comfort fast doesnt get best mileage noisy ac leaf lot table wouldnt way ninth jeep product ive owned throughout year get jeep bug hard stray away would given five star dealership bought san antonio dodge chrysler jeep forever sore spot poor service top bottom,1
awesome truck mpg make second thought,1
car collaboration gm toyota us toyota drivetrain speed manual transmission notoriously weak front countershaft bearing making prone early failure aside theyre extremely reliable vibe interior well designed comfortable growing family passenger front seat rigid plastic surface back fold flat table many diaper changed mine vibe mile considering speed rebuilt last easily,1
good handling expensive,1
first new car bought year,1
mechanically truck good couple minor repair changed original brake pad mile still couple thousand mile left pad body wise good rust thru year rear fender driver side rocker panel starting go head liner starting come loose mile day made body good drive train would excellent truck slt extended cab,1
ive put mile touareg tdi executive one issue voice command system otherwise vehicle flawless however mainstream suv mid sized hauler still seat offer room compact suv youre predisposed honda pilot ford explorer vehicle find priced perhaps equipped compared mainstream choice appeal youre contrarian doesnt like seeing road time appeal want luxury inside dont want proclaim status outside appeal want overbuilt bank vault feel like traveling roadway appeal want thoughtful nocompromise engineering delivers subtle feature advantage immediately apparent discovered time use vehicle remember touareg platform porsche cayenne audi q model built three went assembly line slovakia view touareg really expensive volkswagen bargain basement porsche designed time vw engineering car thats reflected basic item like thick door hinge made cast metal complex sub system like motion allwheeldrive audis quattro system sound like formula highvolume sale success however approach vehicle purchase different angle people touareg might feel right,1
bought sport edition like everything ride back camera touch screen wont rate star paint thick strong enough scratch easily,1
strongly disagree review ive spent barely penny mine complaint bit loud quite luxurious infinitis ive owned still get great gas mileage mpg mile still even replaced brake upgraded version navigation leather chrome wheel,1
solid vehicle good mileage quiet comfortable drive dont like onstar nav system contact onstar use,1
great little suv mine since loved fit lot cargo rear seat small stow away drive handle great good mpg highway add chip kn air filter replace brake ball joint tire since purchase rust issue tho notorious rust bottom door rocker panel find one thats garage kept little rust issue buy,1
sle double cab z x tow value package ltr speed wheel black dont pullor haul ton loaded couple time commute ive couple road trip got great deal last october last available truck ride great plenty comfortable great ride mean truck still stiffbouncy compared cer clothnylon seat stain resistant look good absolutely sign wear coming mi easy drive good visibility mostly came heated front seat work great fold rear seat floor uneven still awkward stow stuff rear dont fold sound system bluetooth integration good navigation gm onstar whats called turn turn direction really work pretty good let onstar lapse trial truck wireless network like pay mo gb data weird part course us cellular signal indicator signal strength cant rely duel climate work great best system ive ever used here thing think gmc need work glovebox light really turn radius really suck auto window annoying hyundai locking fuel door need say center stack electronics acted couple time sometimes read txt message sometimes sometimes take minute phone connect ive system crash twice driving reboots weird call fail connect message go away like message got nice display willplay movie long driving there icon everything screen siriusxm vehicle advisor couldnt even figure keep pushing radio button get really like truck would buy problem hope gm work fix add thing really car,1
comfortable car family friendly lot space compartment everything,1
far really like small problem need repaired like suv already knew mpg wasnt great okay retired drive much,1
wonderful purpose built machine ive yet use vehicle nearly offroad capable stock form wrangler ive told toyota land cruiser come pretty close though personal experience however tldr wrangler nearly unstoppable offroading certainly nice beautiful day since roof removed lack comfort driver would expect particularly one considers tend command higher price many vehicle generally reliable long wellmaintained breeze work since relatively simple machine particularly expansive engine bay theyre fun vehicle able one vehicle plan daily driving long distance cant recommend certain satisfaction owning wrangler although often lack many creature comfort like ac power lock window antilock brake case decent sound system truly incredible theyre built said cant recommend wrangler daily driver people due lack comfort truly horrible gas mileage lack sound deadening generally simple even crude feeling sacrilege know want mention ride first saying bouncy bouncy yet despite bouncy particularly shockabsorbing quite jarring time realize built offroading still manage comfortable road hint really partially linked ride rather loud inside cabin due lack sound deadening kind soft top like mine mph one practically yell understood passenger especially passenger back seat yelling absolutely necessary understood fair hard top model better regard soft top still quite loud highway speed regardless also sideeffect forget listening music driving highway soft top wont able hear anything screeching high youve maxed volume downright painful promise wont time moving fuel economy great live east tennessee little way flat ground severely impact fuel usage ive heard wrangler get much mpg woohoo efficiency average milespergallon depending much driving done highway often little keep mind wd wd mpg drop single digit yeegh speaking wd system excellent seems wellbuilt performs well environment snow mud loose rock sand particularly sloppy mud problematic jeep complete without winch must get situation might get stuck wrangler also might well snowmobile deep snow wd engaged still drive climb thing snow incredible really confidence inspiring said improper tire handle winter weather arduous offroad condition performance system severely handicapped ought nobrainer mentioned nonetheless l engine jeep wrangler ever despite truly atrocious fuel economy solid reliable engine properly maintained furthermore engine bay spacious enough maintenance much chore vehicle better still wrangler relatively simple machine much maintenance completed little experience wroking vehicle great vehicle learn since rarely ever require special tool body contortionist perform maintenance time trouble working mine drop transmission replace clutch cable top transmission needed removed hard reach everything else pretty simple though overall wrangler great function well daily driver unless free time offroad extra cash fuel theyre expensive unrefined sometimes harsh wow fun also forgot mention seems sort jeep club owning wrangler get sort camraderie among jeep enthusiast seems vein harleydavidson owner strange first also really cool owning certain vehicle attract fellow owner,1
great handling torque power curve reliable fun drive,1
outstanding vehicle fun drive great handling surprising quick fast enjoy body style particular vehicle homework previous maintenance understand great reliable vehicle beware stay away done major hiccup model instrument cluster replaced issue older tt along usual timing belt water pump thing addressed timely manner fire away prepare fun ride,1
bought van k mile dealer think rental avis sticker inside driver door clean looked one several year get wife didnt like small passenger footwell used month got haul load tool mile son used haul friend ski trip hauling everything since thats strong point room mini van fourteen year later still driving second car put k mile total k pulled uhaul trailer smaller one sailboat pop camper hauling jayco camping trailer lb looked newer small van none fill niche one cost k sorry chevy stopped making rate putting mile one driving another year wife laughing foot still cramped,1
met,1
nice little car sporty looking best thing car plastic body rust worst thing car small engine doesnt much power gas mileage isnt great small engine still great car normal commute great long distance driving,1
great large family long distant trip problem ignition coil first bought used resolved family wagon year,1
nissan altima gxe one issue last year covered warranty intake manifold replaced within several year purchase mile odometer driving well use nissan much le newer car let say absolutely regret nissan wonderful car us drop oil,1
bought saab turbo convertible last summer original condition run beautifully since cooling fan fixed radiator replaced need minor repair engine transmission strong love taking drive top,1
ride smooth adjustment learn handle steering shorter wheelbase much fun cant wait snow get mountain get,1
good little suv drive like car awd make capable road still getting good gas mileage,1
good car except area sight lot blind spot,1
bought car new rallye liter multiair turbo speed manual dual dry clutch like car lot reliable minor issue major issue covered warranty pro bluetooth peppy turbo lot space sporty look price good gas mileage con faulty electrical turbo failed mile came cheap tire mile turbo died covered power train warranty dodge dealership took week fix nj summertime degree wintertime degree guages dashboard always work,1
alteration fit perfect,1
ride smoothly con part like handle window little weak,1
spacious comfortable vehicle tremendous ride towing capacity,1
excellent truck handle anything throw ride little rough well worth classic toyota reliability downside reason four star t marketing flop toyota sold full size truck smaller competition initially offered v make part somewhat hard find though well worth,1
gas mileage minus,1
great gas smaller full size truck buy another deisel come,1
pretty good speed manual transmission l v k bump along way still pretty good vehicle considering bought k brake tire would expect smaller suv changed cat warranty k changed water pump common jeep easy fix k sat two year without license changed radiator kagain hard job throw bearing clutch replaced k driven daily ny nh vt driven road rough condition muddy snowyicy standing water ft deep towed several boat enclosed ft trailer hauled many deer lot firewood moved several time little rough ride day k still gettin job done,1
bought used mile body style stayed almost exactly model year close engine incredible power close bhp think awd model would great investment replaced collision sensor washer pump led headlight led interior light easily part super affordable amazon nice car customize good smooth ride gas mileage around town lot gadget navigation audio choice like satellite radio hard drive storage input charging cell phone accessory bluetooth audio phone model year possible dealer update great seat heater steering customization pretty good blind spot wagon much issue parking leaving crowded parking space thanks parking assisted camera everywhere help one stay line easily many useful feature like speed sensing wiper auto entry light come night one approach car fob car light near car sits high enough help see around car low enough really take corner maneuver without body roll like crossover smaller suv tire reasonable oil change insurance also bad,1
pro amazing gas milage lot interior room size comfortable ride con poor acceleration even power mode cheap feeling interior material still getting use unique design beeping reverse needed annoyance,1
car big fun since bought almost nine year ago reasonably reliable though sink money gotten older get pretty bad gas mileage liter six doubt due unable resist putting pedal metal often car red spyder gt way cooler amazon stock photo,1
overall enjoy vehicle ride run well mile dependable complaint would gas mileage usual advertise,1
comfortable drive plenty pep transmission little rough time,1
nice bell whistle certainly great looking hate speed transmission get confused time love gm think could done better,1
lot room compared chevy express better seat better layout cheap component though seatbelt cover break easily arm rest wearing quickly,1
bought used still drive daily reason star ford caused transmission leak torque converter factory recall year back cost repair leak,1
bought rav used last year around time driving tiny chevy cavalier couple year say quite improvement drive nicely roomie inside front back seat complaint middle seat back kind joke seatbelt interferes one right next actually getting three people back difficult especially true u also need consider car seat id love install year old car seat middle however getting tight install wouldnt interfere seatbelt would difficult accomplish otherwise enjoy car great job getting point point b,1
father bought ford ranger new purchased year ago spring year old vehicle k mile really cant complain ac lowes home depot truck haul stuff around thats big deal steering gear box needed replaced original unacceptable amount slop unusual age ranger driving month entire hydraulic clutch system rebuilt run like champ electric window motor bit sluggish still work time,1
ride great solid car,1
good car minor annoyance bad windshield wiper window motor regulator going bad ab becomes non functional random time great otherwise,1
comfortable vehicle stable tough engine good response gas per milage isnt great ok,1
love ttits got knock wood given slight problem keep oil changed regularly fun drive kid always pulling beside interstate want race though lol,1
love crown victoria car reliable space inside hard beat likely keep vehicle long especially considering cheap part,1
love truck get one midwest prepared rust seized bolt get compliment every time drive great snow street,1
zr model great gas mileage get combined little price drive heck lot better hd time,1
benz restored paint good interior good need leak fixed instrument work done car solid,1
svt version hp v spd total sleeper go squarely bmw year handle awesome fwd oversteers need say quiet quality interior thats ideal quality soundsystem wake engine k rpm easiest drivetrain work v shoehorned avoid sunroof version problematic,1
ive got truck new last year mile still expect sv king cab wd v speed manual old design thats wanted dont expect crossover like gas mileage youre really worried dont need truck begin see mpg combined mpg highway good enough power good throughout rpm range ride stop steer decent sticker price little included basic power accessory heated seat spray liner etc truck deal try touch comparable tacoma coloradocanyon cant,1
great truck strong power train,1
great full size truck bad gas big truck reliability toyota toyota could build full size truck bit better fuel mileage tundra would definitely get star rating,1
still smooth ride moderate electronic ignition issue run smooth,1
overall great car price ton feature like navigation touch screen radio xm cd player sunroof nice subwoofer factory get pretty good gas mileage around mpg plenty room haul guitar equipment around,1
minivan best thing since sliced bread complaint mechanism operate sliding door joke door broken several time quite pricey fix door cost make usable several thing go wrong matter break price repair remains,1
honda civic morning couldnt tell difference would grab pair key go guess would buy,1
k mile every day driving still love truck ford guy many year many front end transmission various issuesi bought ram glad climbing hemi powered beast put smile face thing fastwith excellent pulling poweroh soundnothing sound like hemi ive virtually issue truck rock solid performer far ive added aftermarket part aid stellar performance best thing ive done far shocksfactory shock horrible installed bilsteins series around load leveling front air lift bag rear haulingtowing truck ride handle great next brakespowerstop extreme tow trailerslotted drilled well still readinggo get ramyoull love,1
far good,1
love coupe plus came preinstalled bluetooth steering control find install updated dme plug play front rear rim low profile tire tend feel road corning much fun using sport shift option enhances drive even bought k two year k wife prefers drive x stereo system ok also installed xm radio radio come preprogrammed work sat,1
great car excellent interior sound system great power obd chip mod maintenance really expensive break,1
absolutely love camaro classy stylish great performance,1
love car,1
ac control work intermittently steering slop even ball jointcontrol armstie rod idler arm steering box intermediate steering shaft replaced slop column,1
good car,1
ive got double cab road long bed xso far solid truck minor quality issue epoxy hold hood hood frame appears epoxy holding area causing hood slightly vibrate highway speed ill get fix k service warranty expecteda truck comfort featuresbut make mistakeits truckit handle like truck ride like truckso dont expect ride like suv car ride well dampened low speed road bilstiens dont well high speed damping highway speed jbl sound system good year old ear amazing pump volume range higher overall im happy purchase though qualityfit finish isnt nice runnerwhich nearly perfect,1
inexpensive transportation far pretty dependable,1
ive car year still get excited car drive extremely quiet smooth road due excellent suspension system lexus roomy inside beautifully designed outside make car one best car ive ever owned,1
like come gas maintenance pontiac vibe economical service car twice year personal mechanic work car run good since live city run great least thing like headlight time gave trouble fixable,1
well like truck electrical crap especially mess sensor knock sensor,1
great little commute car get great gas mileage city hwy go well thru snow easy park one side windy car get blown road really noticeable hwy speed being small car would great car beginner driver relatively inexpensive car far insurance rate replacement part go two aveo hit deer within four month got replacement part salvage yard cheap color car painting required needed timing chain replaced around k mile likely well past manufacture suggested time thing major thing went wrong besides expendable item tire brake etc great little car one k k weve since time bad arent made replacement car chevy sonic bought one new car family actually traded one sonic bought back next day actually looking new truck showing wife replacement aveo bought new car,1
would like open little slower worked good trouble anchor go tail gate turning go tighten turn accurate,1
fit perfectly jeep compass thin metal original part original cvt filler metal tube shouldnt broken st place one metal piece happens youd imagine luckily stuckfell engine protection shield slid otherwise would detected causing transmission issue time see jeep forum however called fca center aware recall joke replace dime k mile warranty,1
love,1
purchased mazda hatchback new dealership car amazing super fun drive great fuel economy great hatchback configuration make extremely versatile hauling type stuff camping gear bike mile ive done routine maintenance one major flaw car started burning oil somewhere around mile burn one quart per thousand mile rate increased ever since started pain rear end add oil every thousand mile super honest mechanic never encourages u unnecessary work said leave alone,1
comment,1
great car easy work tough part also inexpensive make working older car like easier,1
