reviewText,overall
part received side mirror part thought ordered didnt even come close looked online least didnt think looked purchased looked exactly like wanted got didnt even resemble fit truck,0
bought mdx apr really regret test drove car felt new mdx obviously stronger new car smell mdx noticed almost mdx tried apr made big mistake think every car strong new car smell disappear several month wrong awful car keep giving smell year even two summer period always drive window open doesnt help finally figure genuine leather seat giving chemical smell personally like genuine leather smell buy coach leather bag must leather smell sometime strong leather piece mdx seat different giving unpleasant chemical smell typical leather smell look seat piece directly touched made genuine leather piece faux leather faux leather smell genuine leather junk would like warn everybody want buy acura car detect leather smell beginning please dont expect disappear short time last long long long time toxic going sell car seems way prevent manufacture making toxic product right please careful want buy car drive little kid,0
first owner nissan quest fuel gauge sudden work found work running gas time fuel gauge would read tank would stall start happened k odometer reading lived check engine light always trouble passing smog inspection two time finally replace whole instrumentt panel pas smog end nissan recall faulty fuel gauge time fixed problem took dealer recall work told work done even wrote letter detailing went expense inconvenience faulty fuel gauge response fault completely disagree wont buy another nissan car future,0
expensive car cheaply made,0
model burn oil regularly check owner manual state normal burn liter every mile schedule oil change k mile engine bone dry oil engine hold liter water pump replaced suspension air bag sensoretc repair eventually became recall bring car dealer replace part even nothing wrong part since paid pocket initial repair submit claim toyota get reimbursedstill waiting get paid claim waiting month toyota isnt company used,0
chevy gone way hill wiring car cheap caused great deal headache money fix,0
bought silverado used k mile since ive multiple issue among often doesnt start battery fine eventually always start ive unable determine problem online ive learned many others experienced issue also idle rough check engine light come sporadically ive gotten different code short dont recommend pickup especially model year,0
bad car,0
fit like sweater thats size big extremely busy work would already returned car version little longer cover would cover ram close would recommend,0
transmission sound terrible week bought brand new,0
dodge charger sxt th anniv edition huge disappointment mile began transmission problem gear slipping car lurching forward stop doesnt downshift making turn took shop said nothing wrong mile touch screen stopped working heated seat would come middle july couldnt shut ac vent change ac blowing foot cant change cant use navigation system etc would never lease borrow rent drive another dodge ever poorly made car america dodge doesnt even honor warrantee ive babied car year mile still fell apart thankfully pile junk lease get rid month,0
cvt transmission dead mile replace zero help dealership nissan enough said bought nissan quality dependability buy honda toyota save hassle ive,0
save money truck money pit engine junk everything else well huge ford fan truck hard try another ford,0
old falling apart le mile,0
car run great hit k mile light dash shine brighter christmas tree everything need replaced sensor gasket name need go german euro car state,0
garbage,0
head gasket intake manifold problem,0
would never another ford ive owned several gm product say avoid cost well toyota next vehicle ford f liter triton outlasted former gm product however without multitude issue coil pack valve seal intake leak evap leak name gm product seemed love alternator starter ford seems enjoy eat coil pack buffet updatei decided buy nissan frontier liter bought price good true love truck ive never interested nissan frontier caused stir still crave toyota tacoma nissan sold japanese product good ford chevy dodge kiss rear,0
bought lemon wouldnt recommend problem engine justvthis week front door didnt open back door latch recall front door pay back door inner door jamming door pulled see frame door door opened unless pulling fear breaking seriously paying k new car worth,0
hard work unreliable lot part break unless know work cost lot,0
vehicle piece junk crappy manufacturer warranty service fleet company mile per year see issue consumer get past mile warranty lower control go transmission fluid must serviced regularly lose transmission name issue never recommend vehicle anyone,0
dont buy truck ive many problem listed reader would think embellished truth im going mention last escapade mile truck started vibrating really bad took dealer said tire needed balanced later vibrating still went major tire chain said needed tire later still went back dealer time said needed new brake rotor four wheel three day later anything vibrating gotten worse ive tried talk chrysler yeah right tried call there protocol dont get talk anyone number twelve person dont place call would make much sense thought writing letter actually make point telling write letter read here deal end lemon sorry damn luck market truck buy ram p actually thought disabled veteran u army year deployed seven time injured three time would make difference oif oef afghanistan think,0
horrible car dont waist money,0
absolutely nothing work car nothing go cart reverse fifth gear dont work park incline wherever go dont use reverse mile check oil water daily bought vw daughter boyfriend ran wood dune buggy thing got divorced inherited back choice car one thing ive always hated car structural strut run roof body car huge blind spot top game car always looking twice three time brake never replaced quite impressive strut need replaced there hole exhaust check engine light mile windshield one two crack way seven eight year black originally oxidized greywhite vw symbol front aluminum foil came part show plastic underneath vw symbol back hatch never hide lock always stuck upside vw came cassette player yeah read right ive never used radio antenna rusted long ago vw dealership wanted hundred buck antenna aint way thats going happen plastic latch open hood broke vw dealership charged buck plastic part despise loathe hate slam vw dealership every chance get early one headlight went dealer charged buck replacing bulb asked soooo expensive take fender change headlight thats blatant lie change light bulb le minute changed battery wen start car security alarm went couldnt get stop called dealership told well tow reprogram computer went inside googled problem five minute found solution open hatch key disable security alarm worked man hate dealership let list good thingsuhuhuh,0
mat didnt fit bummer,0
coil went leaked oil constantly torque converter slipping traded got paid month earlier rd audi rd disappointment learned lesson finally,0
fit chevy malibu,0
place fit zero star ive never owned bigger rust bucket turd gm chevrolet product like vehicle barely ever run drain wallet dry id buy two enough said,0
corrosion front suspension led failure could costed life nissan dealership took responsibility repairing wanted see web failure since hawaii fall category ice state use salt melt road thus increasing corrosion part want pay repair surrounded salt water daily,0
multiple issue transmission brake even interior company stand behind product never buy dodge product,0
model x second tesla reasonably good experience certainly best car model model x massively disappointing many level example car loaded stupid gimmick riddled problem insurance huge problem company dont want insure tesla whatever reason model x especially difficult incredibly expensive insure selfdriving feature joke weak limited much worse model tesla failed disclose problem tesla like make customer quality control work without paying ive wasted much time explaining problem numerous people tesla nothing get done excuse wasted time car got bad rating consumer report sure check review think lowest rated luxury suv car isnt designed well lack good usable cargo space lot bug door look cool disaster many way wonder get range rating real person actually achieve would drive like old lady lol deserve better seem many brainwashed tesla cult member check consumer report buying car,0
longer tundra tocoma satisfied continue,0
absolute piece crap lot road noise ride awful seat way high stiff steering seat belt tightens uncomfortable basic sound system terrible microphone phone connection pick road noise would never buy one honda fit also awesome except road noise,0
dos fit,0
real sty quality dont even try hyundai kia,0
service manager shop year working make model ever anything junk saab ive never seen gave one star negative star,0
need selection,0
least reliable vehicle ever owned built fail incredibly uncomfortable rust hardtop leak difficult put softtop plastic cheep interior serious drop quality performance even since model trim leased hand,0
well built doesnt feel solid suspension soft steering vague would buy,0
mil oil consumption quart per mil service say okay ive done time brake disc still something right except replaced thermostat horrible car first last volkswagen,0
horrible engine blew choice replace engine bought week break wish could go back time,0
give zero star look video internet search f death wobble nhtsa video file number pe show well occurs vehicle problem disconcerting occurs speed mph occurs high speed front tire hit bump pothole imagine would happen pulling full load happened spent vehicle new spent hundred dollar try fix ford problem multiple visit external front end shop reviewing nhtsa web site indicates ford known problem year done nothing fix contacted ford motor company directly told contact dealer two ford dealer one texas one california told ford could fix suggested go independent front end shop get stiffer steering damper installed shop looked truck concluded everything spec front end installed new steering damper first one fix problem installed stiffer one problem reoccurred nhtsa web site includes ford technical service bulletin suggests dealer verify tire pressure followed replacing steering damper tightening steering suspension bolt adjusting alignment none indicates ford know effective corrective action problem im done ford purchased chevrolet silverado last year could happier chevy truck get star,0
alternator went month ownership new car every exterior bulb replaced least twice paint hood right rocker panel bubbled rust dealership said wasnt warranty even though car year old battery mounted driver side front wheel make expensive replacement unless know youre headliner falling po,0
never order wire zone ever make sure friend aqaintences dont either,0
head light worst ever drive car buying night new style see large game side road even road year driving experience area lot large game never hit animal driving car second notice impacting mph could see shoulder contacted acura clear documenting civil suit come someone killed could give negative would,0
nothing good say car,0
seat cover fit seat tight wouldnt go top part truck f regency model,0
product never worked car dont start regardless much try recode,0
truck cost lot money repair timing chain required replacement k mile defective secondary timing chain tensioners whirring technical service bulletin available nissan however would cover cost repair ab module went defective k take great care vehicle change fluid correct interval change tire early side keep clean dont buy nissan truck company put crappy part save buck cost long run buy toyota honda looking smaller truck,0
didnt fit jeep,0
truck vibrates highway speed shop three time two week brand new set tire installed mile going back shop next week vibration front tire rod jam found loose yesterday traded wobbly steering front wheel vibration hunk crap expensive house crap one ever ever ever ever ive lifelong ram person never,0
every one ive cracked head loses coolant water never got better mpg cruise control highway ton diesel get mpg got hp throwaway pickup cheap buy simple throw,0
car nothing garbage costed bunch money already first week ive obviously burn oil like crazy common issue car loud inside car seems like everything made extremely cheap hardly window work due bad switch window track motor dont recommend vehicle anyone type driving matter much work put there always something need replaced fixed thing liked far air conditioning work well sunroof actually work doesnt leak owned car day immediately went got newer vehicle dealership,0
link vehicle,0
hate car there blind spot side extremely difficult see whats coming side navigation screen small difficult view driving size ofy cell phone screen basically car terribly priced honda pilot isnt comparison car ive toyota lexus like didnt know buying never expected bad ive car three month mile intend dump spring plus towing ability would better buying f toyota raising price every year improvement,0
mile front wheel bearing needed replacing currently mile dealer repair time various fuel electrical problem battery still drain completely within day without driving dealer still find issue slow acceleration diesel pulling performance worse ford dodge even close say ride better ford dodge,0
beautiful truck motor piece junkcost repairtransmission replaced timesstarter replaced alternater catalytic converter replaced mile,0
besides numerous recall car required new transmission mile rear hatch didnt work always something broken literally figuratively spent time behind wheel rental car one shop behind cherokee trailhawk third jeep ive owned last oh way really didnt much storage space traded mile subaru outback,0
purchased f ftx yr old mi truck looked near perfect inside appeared well cared month ive ive replace radiator hose water pump put complete new brake front including caliper trying figure rear end shaking bouncing tire already ruled far im happy truck keep thinking could bought newer silverado would cheaper point higher payment like look truck cab ride awesome shaking im hoping im done fixing bounce worth truck reliable ill lose lot trading,0
mile truck started ever popular limp mode push gas floor truck move idle almost ran wheeler happening happy truck ecoboost model,0
ford f platinum exact best looking truck road truck bell whistle truck v engine ample power however give star rating due following sunroof top came rail repaired dealership warranty covered making hard left hand turn sometimes hear noise front end dealership ensured mechanical issue repair made one cylinder head replaced mile truck warranty covered ford warranty happened relatively new truck never fan extended warranty case bit backside,0
always ford man however really screwed truck bought new white ford major problem white vehicle get rust spec truck le year brother bought new problem dealership buff send home warranty run think twice problem well documented internet im ready new truck first time dont think ford,0
absolutely lowest quality truck ever owned ant dealer customer service even worse brake job truck mile warrantee expired th dealer service department belongs salvage yard one legitimate mechanic place screwed many repair truck wouldnt even trust put gas lawnmower much le lay another hand garage space wasting junker,0
really like physical size ergonomics feature lariat owned gmc sierra similarly equipped toyota tundra one luxurious smooth riding three unfortunately nearly well engineered constructed two take good care vehicle ensuring receive required maintenance full synthetic oil change thats factor near zero repair issue two truck gmc door seal replaced tundra small part tail gate latch break except tire pushing k mile replaced f k mile currently sync system enough repeated issue triggered lemon law complaint eventually settled ford free k extended warranty front brake rotor warped ground flat unfortunately ford didnt replace fourth battery warranty plan keep k odometer extended warranty complete plan trade ram gmcchevy,0
good quality truck never let,0
truck engine knock ford garage refused fix traded new gmc sierra last week v different dealer watch engine knock youtube hear em there many people video oil changed dealer every k,0
jeep look nice need thing replaced like rest roll bar pad door bikini top spare tire rack side step thing like lift big tire wheel,0
hard find part much choose way part choose form,0
lot electrical issue even replacing fuel pump fuel relay still getting fuel engine good strong engine transmission rwd k mile fighting bad ground faulty wiring whole way,0
used one truck four cylinder five speed manual wd truck necessarily bad size mean agile go place truck high ground clearance size make good road low range handle hill ease get great fuel economy problem truck ride terribly bumpy although wngines modified make good power stock incredibly sluggish size weight class big thing frame truck known issue frame rotting right recalled many truck taken time limit recall passed buyer owner beware fixed outright dangerous checked purchase inspect rush issue mine owned family several year made aware recall frame broke nearly half thankfully highway driving hour beforehand would however find one frame replaced likely outlast matter punishment put rate two star instead one,0
junk,0
would truck werent drivetrain cummins engine heavy duty speed manual gearbox dana front axle dana rear axle make worthwhile dodge truck low quality frustrating live cheap paint flaking year tin foil used chrome grill shell wrinkled starting peel leaving spot gray plastic showing decorative plastic side trim discolored starting separate truck body interior component dashboard cheap look like injection molded junk radio never capable good reception dash mounted speaker problem headlight switch burning several time headlight nothing cheap plastic mine need replacement one inner headlight bucket broke road vibration road splash get burn bulb cant drive night rain could go get idea,0
really greatest vehicle fixing pretty cheap,0
spend lot money fix stalling prob good still fix,0
part fit purchase according jeep year,0
never many problem truck bought two new auto gm never buy gm build cheaper gm better motto happened old hummer saturn pontiac wakeup call,0
truck apparently worst automatic transmission ever made ive owned truck various make life never replace transmission bought dodge ram dont even carry much weight haul heavy trailer third transmission one break sure part truck oh hell thought good idea bury heater core deep literally must pull entire dash assembly replace never,0
day one thing tended go wrong truck first recall wheel lug short replaced second real joke cruise control switch associated brake master cylinder could catch vehicle fire fix put fusible link kill power switch cracked wonder replace defective switch design another found model ford vehicle even though truck warranty oxygen sensor quit working cost almost replace take retail price part plus minute replace part new one least took replace second third oxygen sensor buy code reader could read analyze clear trouble code continuously show check engine light year old driver door window go updown electric passenger side window sporadically work driver side door mirror cracked ice expansion transmission shifter steering column broken,0
good running vehicle lot power pulled ft camper problem comfortable good style loved expedition blew spark plug cylinder read common problem aluminum head crap easy damage thread plug likely reason failure vehicle previous ownerowners pore maintenance vehicle xxxx mile real issue besides much pain change coil pack plug cylinder air suspension crap well junk replace coil spring easy cost hardly nothing self get spring junk yard,0
cost way much upkeep money drain,0
got car dollar daughter car run fine k k air con condenser died blend door air con expensive door actuator gone rear power window roll without help toyota great teenager vehicle,0
fun drive maintenance nightmare car reason purchased cadillac at,0
terrible gas mileage eat window regulator changed everyone twice driver side three time plastic holding cable snap,0
definitely best truck ever owned good gas frequent engine problem worst body basically rotted away one point gas tank dropped driving,0
replace engine remanufactured mile changed oil religiously every mile,0
liking car moment problem engine running cant retrieve computer code used two different scan tool,0
get correct part buy eles time restriction,0
mechanically thing beast problem come shortcut gm seems taken freaking vehicle biggest beef electrical system ok wonderful government mandate requiring computer running system one place simply skimped wiring however thats exactly gm done starting fairly young age truck suffered inferior security system causing want start fairly widespread problem start looking fact talk gmchevy owner odds know least person suffered security problem reset system time time inferior gasket also problem plastic really luckily father able tear redo intake manifold gasket day wasnt quite big deal could got lucky coolant leaking outside engine engine im sorry purchased truck consistently reliable vehicle except first two year guess thats goal overcharge vehicle make sure die early hope come back ive better luck ford arent even mechanically sound,0
good car rebuild transmission hondas defective tranny replace engine also due defect causing oil leak coolant passage hairline crack cylinder wall good,0
car started well complaint come performance however expect transmission go needing replaced year seems pervasive problem honda accord,0
disappointed seal headlight faulty assembly leaked water,0
transmission issuesslippage death wobble difficult fix eitherboth,0
jeep wrangler since new since added lift kit gear done jeep lousy everyday driver also died x trail crankshaft position sensor problem jeep wrangler lousy performance none poor gas mileage well also good highway driving due height short body making unstable high speed jeep good one thing x trail mountain practical vehicle way reason keep afford another car worth trading jeep,0
bought yr hard work part cost lot hard get fix took hr get intake ride ok good room cab,0
bit hoopty tailgate rusted gauge cluster didnt work exhaust manifold rusted still fun rod,0
stay away ford product acronym real pump much money getting car fixed,0
good find one taken care,0
truck plagued issue biggest problem timing chain guide made poor construction break anywhere k happens bend valve k fix since pull engine truck thing like ac issue blend door front ax leaking stereo display burn rear shackle rot name run forever k still going luck draw,0
transmission died mile,0
bought car used son drive mile pull engine transmission replace crankshaft timing sprocket harmonic balancer engine slipped time entire drive train replaced oil seal gasket coolant seal engine transaxle also rebuilt power steering pump replace starter car ride drive nicely bit maintenance money pit replace alternator valve cover gasket brake reseal drive alxes replace wheel bearing front repeated ongoing issue upstream oxygen sensor bank throwing check engine code p p sure high mileage vehicle take alot part shade tree mechanic time effort keep going another one car,0
nice running v engine comfortable gas hog expensive part difficult work,0
dont know newer grand cherokee ive owned grand cherokee theyve given nothing problem best jeep ive ever owned cherokee,0
star amc derived straight six star death wobble mopar electronics failed transmission k,0
didnt pay lot car first year pretty good maiifold update almost month engine replaced bullet proof engine replaced yet want add car mile first engine replaced ford chysler go mile engine still ran strong gm good thing didnt pay lot car start still driving car trying plan next one mile,0
car fun drive get garage great power awesome torrque drive like slot car totally unreliable yeah year old k need much maintenance people say expensive work well really car there much bought daughter great shape price right id stay away unless youre fairly competent wrench,0
turn signal fit bad loose connection mounting screw right recommend product,0
reliable truck except dash self destructing day glove box fell floorboard cup holder broken earlier,0
didnt buy ram ram really like ram,0
inpossible fix driver door pin door pop wont stay open shuts leg unexpectedly one fix heater control problem wheel drive frustrated gave mine son drive without heat engine transmission good though,0
deliver really slow come nut install ugh,0
mile itrate good,0
bought truck used blown valve body gasket ree transmission bought knowing fixed process learned lot ford wouldnt recognize fault gasket original purchaser make service bulletin tho would pocket owner anti theft system wire issue left stranded le pocket book get fixed seems yet another common problem vehicle recognized ford say today driving blazer,0
inadequate brake even repeated repair couldnt keep ac operating engine hp seemed limited probably clogged cat converter blew head gasket sold,0
dont one mile,0
nice van run great transmission problem power sliding door also like act,0
good layout size good motor terrible trans died k second one died k achilles heel van,0
